{
  "version": 1,
  "generatedNote": "首个样板：DigitalStaff 平台默认电商本体域 ecommerce ↔ cooliebase-all mall/pay 的如实映射。证明映射法可行，供 100+ 微服务迁移复制。mall/pay 现为模板骨架子集(as-is)，system/infra 标注为跨域公共底座(不属电商域)。事件映射体现二者形状差异：本体域=状态机生命周期事件，业务侧=动词事件，需从 action 状态迁移派生。",
  "ontologyDomain": {
    "id": "ecommerce",
    "displayName": "电商平台",
    "source": "backend/modules/ontology/services/schemas/ecommerce.schema.js",
    "entityCount": 17,
    "actionCount": 24
  },
  "catalogDomains": ["mall", "pay"],
  "crossDomainBaseline": [
    { "catalogDomain": "system", "role": "shared-baseline", "via": "公共底座直用(RBAC/用户/租户/字典)", "note": "system 不属电商语义，是所有域共用的 RBAC/租户底座；勿纳入 ecommerce 实体" },
    { "catalogDomain": "infra", "role": "shared-baseline", "via": "公共底座直用(外观/代码生成/文件)", "note": "infra 为基础设施控制台，同为跨域底座" },
    { "catalogDomain": "fintech", "role": "neighbor-domain", "via": "跨域关系 SETTLED_IN_FINTECH (Payment→fintech.Transaction)", "note": "本体域把资金结算折进 fintech 邻域；cooliebase pay 域承载 Payment/Refund，资金侧对接 fintech" },
    { "catalogDomain": "logistics", "role": "neighbor-domain", "via": "跨域关系 FULFILLED_BY_LOGISTICS (Shipment→logistics.Waybill)", "note": "履约物流在邻域，cooliebase 暂无 logistics 模块(gap)" },
    { "catalogDomain": "erp", "role": "neighbor-domain", "via": "跨域关系 POSTED_TO_ERP (Order→erp.Ledger)", "note": "财务过账在 erp 邻域，cooliebase 有 erp 模块" }
  ],
  "legacyServices": [
    {
      "name": "mall (商城域)",
      "stack": "node",
      "middleware": ["mysql", "redis"],
      "catalogDomain": "mall",
      "fidelity": "as-is",
      "valueTag": "keep",
      "migrationStatus": "mapped",
      "note": "cooliebase mall 模块为电商域『商品+订单+营销』骨架子集，原样映射。老系统迁入时以本体域 17 实体为对照补齐缺口。",
      "entityMap": [
        { "ontologyEntity": "Product", "target": "mall 商品(SPU)", "fidelity": "as-is" },
        { "ontologyEntity": "SKU", "target": "mall 库存单元", "fidelity": "as-is" },
        { "ontologyEntity": "Category", "target": "mall 分类", "fidelity": "as-is" },
        { "ontologyEntity": "Brand", "target": "mall 品牌", "fidelity": "as-is" },
        { "ontologyEntity": "Order", "target": "mall 订单", "fidelity": "as-is" },
        { "ontologyEntity": "OrderItem", "target": "mall 订单商品行", "fidelity": "as-is" },
        { "ontologyEntity": "Promotion", "target": "mall 促销", "fidelity": "as-is" },
        { "ontologyEntity": "Coupon", "target": "mall 优惠券", "fidelity": "as-is" },
        { "ontologyEntity": "Customer", "target": "member 会员(C端)", "fidelity": "adapted", "note": "买家用户映射到 member 域(C端用户模块)，非 mall 内部" },
        { "ontologyEntity": "Address", "target": "member 收货地址", "fidelity": "adapted" },
        { "ontologyEntity": "Review", "target": "mall 商品评价", "fidelity": "gap", "note": "cooliebase 模板暂无评价表，迁入时补 nodeType/表" },
        { "ontologyEntity": "Warehouse", "target": "wms 仓库", "fidelity": "adapted", "note": "仓储在 wms 域" },
        { "ontologyEntity": "Inventory", "target": "wms/mall 库存记录", "fidelity": "adapted" },
        { "ontologyEntity": "Shipment", "target": "(logistics 邻域)", "fidelity": "gap", "note": "cooliebase 暂无 logistics 模块" }
      ],
      "actionMap": [
        { "ontologyAction": "PublishProduct", "target": "mall.listProducts(+上架接口)", "fidelity": "adapted", "note": "模板暂只有 list，上下架接口迁入时补" },
        { "ontologyAction": "OffShelfProduct", "target": "(mall 下架接口)", "fidelity": "gap" },
        { "ontologyAction": "UpdateStock", "target": "(mall/wms 库存接口)", "fidelity": "gap" },
        { "ontologyAction": "PayOrder", "target": "mall.listOrders(+下单/支付流)", "fidelity": "adapted" },
        { "ontologyAction": "ShipOrder", "target": "(mall 发货接口)", "fidelity": "gap" },
        { "ontologyAction": "CompleteOrder", "target": "(mall 完成接口)", "fidelity": "gap" },
        { "ontologyAction": "CancelOrder", "target": "(mall 取消接口)", "fidelity": "gap" },
        { "ontologyAction": "IssueCoupon", "target": "mall.issueCoupon", "fidelity": "as-is", "note": "几乎逐字对齐，最强样板" },
        { "ontologyAction": "LaunchPromotion", "target": "(mall 促销接口)", "fidelity": "gap" }
      ],
      "eventMap": [
        { "semanticEvent": "OrderPaid", "derivedFromAction": "PayOrder(pending_payment→paid)", "ontologyLifecycleEvent": "OrderProcessing", "legacyTopic": "order.paid", "fidelity": "adapted", "note": "本体域无 OrderPaid 语义事件，从 PayOrder 状态迁移派生，对齐老系统 Kafka topic" },
        { "semanticEvent": "OrderShipped", "derivedFromAction": "ShipOrder(paid→shipped)", "ontologyLifecycleEvent": "OrderProcessing", "legacyTopic": "order.shipped", "fidelity": "adapted" },
        { "semanticEvent": "OrderCompleted", "derivedFromAction": "CompleteOrder(→completed)", "ontologyLifecycleEvent": "OrderCompleted", "legacyTopic": "order.completed", "fidelity": "as-is" },
        { "semanticEvent": "OrderCancelled", "derivedFromAction": "CancelOrder(→cancelled)", "ontologyLifecycleEvent": "OrderCancelled", "legacyTopic": "order.cancelled", "fidelity": "as-is" },
        { "semanticEvent": "CouponIssued", "derivedFromAction": "IssueCoupon", "ontologyLifecycleEvent": "CouponActivated", "legacyTopic": "coupon.issued", "fidelity": "as-is" }
      ]
    },
    {
      "name": "pay (支付域)",
      "stack": "springcloud",
      "middleware": ["mysql", "redis", "kafka"],
      "catalogDomain": "pay",
      "fidelity": "adapted",
      "valueTag": "keep",
      "migrationStatus": "mapped",
      "note": "本体域把支付折进电商域(Payment/Refund 实体)+跨域 fintech；cooliebase pay 为独立模块，承载 Payment/Refund 并对接 fintech 邻域。域边界与本体域不同(记录为 adapted)。",
      "entityMap": [
        { "ontologyEntity": "Payment", "target": "pay 支付单", "fidelity": "as-is" },
        { "ontologyEntity": "Refund", "target": "pay 退款/售后单", "fidelity": "as-is" }
      ],
      "actionMap": [
        { "ontologyAction": "ProcessPayment", "target": "pay.createOrder", "fidelity": "adapted", "note": "本体 PayOrder 创建 Payment；cooliebase 用 pay.createOrder 承接" },
        { "ontologyAction": "ApplyRefund", "target": "pay.createRefund", "fidelity": "as-is" },
        { "ontologyAction": "ApproveRefund", "target": "(pay 退款审批接口)", "fidelity": "gap" },
        { "ontologyAction": "RejectRefund", "target": "(pay 退款驳回接口)", "fidelity": "gap" }
      ],
      "eventMap": [
        { "semanticEvent": "PaymentSucceeded", "derivedFromAction": "ProcessPayment(→success)", "ontologyLifecycleEvent": "PaymentCompleted", "legacyTopic": "payment.success", "fidelity": "adapted" },
        { "semanticEvent": "RefundCreated", "derivedFromAction": "ApplyRefund(→refunding)", "ontologyLifecycleEvent": "RefundActivated", "legacyTopic": "pay.refund.create", "fidelity": "as-is", "note": "cooliebase 已有 pay.refund.create 事件字符串，直接对齐" },
        { "semanticEvent": "RefundApproved", "derivedFromAction": "ApproveRefund(pending→approved)", "ontologyLifecycleEvent": "RefundProcessing", "legacyTopic": "pay.refund.approved", "fidelity": "gap", "note": "审批接口与事件迁入时补" }
      ]
    }
  ]
}
